{
  "acquisition_method": "operator-manual-observation",
  "admissibility": {
    "rationale": "Operator-directed per-instance Manual Witness admission (issue #3 comment 5281497231 §1) with excerpt-scoped retention. Known epistemic limits: 'Extended time' is the club's language; no exact recovery timetable is asserted. Practice-observation reporting for Coleman's readiness; not game evidence.",
    "state": "admitted"
  },
  "admitted": true,
  "content_digest": "sha256:8fcf5e3ccd1380c119c912813cf9817e172886eddb3afb261929f08af0629f01",
  "content_path": "preflight/tunsil-absence-shock-v0/sources/src-commanders-coleman-tackle-confidence/excerpts.txt",
  "context_match": {
    "context_ref": "context-was-2026-camp-tunsil-shock",
    "matched": true,
    "rationale": "First-party club reporting on the injury timeline language and the replacement line configuration inside the bounded window."
  },
  "directness": "direct",
  "freshness": {
    "rationale": "Retrieved once on 2026-08-13 before the bound cutoff; no later revision of the page was observed or admitted, and the page is not assumed immutable.",
    "state": "current"
  },
  "intended_use": "q1 injury nature/timeline language; replacement and line-configuration facts. Article: \"Commanders confident Coleman can move back to tackle after 'excellent' offseason\" by Zach Selby.",
  "limits": {
    "licensing": "Copyrighted NFL club editorial content; no license for retention of full bodies; excerpt/reference admission only.",
    "privacy": "contains_no_private_user_context",
    "redistribution": "Not redistributable; internal lineage use only; retained excerpts stay inside this governed package.",
    "reportability": "Internal only; never quote beyond the retained excerpts; never represent club-asserted figures as charting evidence."
  },
  "locator": {
    "kind": "url",
    "value": "https://www.commanders.com/news/commanders-confident-brandon-coleman-tackle-laremy-tunsil"
  },
  "promotable": false,
  "provider": "Washington Commanders official club site (commanders.com)",
  "replayability": "lineage_only",
  "reportability": "internal",
  "retention_mode": "excerpt",
  "revision": {
    "revision_id": "sha256:147606ce3e101d462673e00d477354011c66ea81fbc73f3f676d956cc7f32842",
    "supersedes_revision_id": null
  },
  "rights_disposition_ref": "NFL club-platform facial terms prohibit systematic retrieval; admission is operator-directed, per-instance, and excerpt-scoped under issue #3 comment 5281497231 §1; full page bodies are not retained or redistributed.",
  "run_id": "tunsil-absence-shock-v0",
  "schema_version": "research-source-metadata/v0",
  "source_class": "operator_provided_observation",
  "source_family_id": "commanders-official-club-site",
  "source_identifier": "https://www.commanders.com/news/commanders-confident-brandon-coleman-tackle-laremy-tunsil",
  "source_object_id": "src-commanders-coleman-tackle-confidence",
  "synthetic_fixture": false,
  "temporal": {
    "admissible_at": "2026-08-13T14:13:09Z",
    "cutoff_at": "2026-08-13T14:13:09Z",
    "effective_at": null,
    "event_time": "2026-08-08T00:00:00Z",
    "first_observed_at": "2026-08-13T14:10:22Z",
    "published_at": "2026-08-10T19:08:48.197Z",
    "retrieved_at": "2026-08-13T14:10:22Z",
    "source_available_at": "2026-08-13T14:10:22Z"
  },
  "upstream_owner": "Washington Commanders / NFL club media"
}
